{
  "schema_version": "A20A_budget_quota_state_v1",
  "profile": "A20_5",
  "wall_clock_minutes": 181,
  "missions_attempted": 10,
  "missions_succeeded": 6,
  "chatgpt_live_calls": 41,
  "gemini_live_calls": 8,
  "gemini_image_uploads": 3,
  "chatgpt_image_uploads": 0,
  "request_more_rounds": 7,
  "format_repair_attempts": 5,
  "branches_created": 6
}
